{
  "manifestVersion": 1,
  "network": "stellar-testnet",
  "deployedAt": "2026-08-11T00:00:00Z",
  "admin": "GAAAAAAAAAAAAAAAAAAAAAAAAAAAAAAAAAAAAAAAAAAAAAAAAAAAAWHF",
  "source": "deployer",
  "initialIssuer": {
    "address": "GAAAAAAAAAAAAAAAAAAAAAAAAAAAAAAAAAAAAAAAAAAAAAAAAAAAAWHF",
    "issuerIdHash": "0000000000000000000000000000000000000000000000000000000000000000",
    "metadataHash": "0000000000000000000000000000000000000000000000000000000000000000"
  },
  "contracts": {
    "protocolConfig": "CDXXXXXXXXXXXXXXXXXXXXXXXXXXXXXXXXXXXXXXXXXXXXXXXXXXXXXX",
    "issuerRegistry": "CDXXXXXXXXXXXXXXXXXXXXXXXXXXXXXXXXXXXXXXXXXXXXXXXXXXXXXX",
    "proofRegistry": "CDXXXXXXXXXXXXXXXXXXXXXXXXXXXXXXXXXXXXXXXXXXXXXXXXXXXXXX"
  },
  "wasm": {
    "protocolConfig": {
      "path": "target/wasm32v1-none/release/protocol_config.wasm",
      "sha256": "0000000000000000000000000000000000000000000000000000000000000000",
      "contractVersion": 1,
      "buildMetadata": {
        "rustToolchain": "stable",
        "cargoPackageVersion": "0.1.0",
        "sorobanSdkVersion": "27.0.0",
        "buildProfile": "release",
        "gitCommit": "0000000000000000000000000000000000000000"
      }
    },
    "issuerRegistry": {
      "path": "target/wasm32v1-none/release/issuer_registry.wasm",
      "sha256": "0000000000000000000000000000000000000000000000000000000000000000",
      "contractVersion": 1,
      "buildMetadata": {
        "rustToolchain": "stable",
        "cargoPackageVersion": "0.1.0",
        "sorobanSdkVersion": "27.0.0",
        "buildProfile": "release",
        "gitCommit": "0000000000000000000000000000000000000000"
      }
    },
    "proofRegistry": {
      "path": "target/wasm32v1-none/release/proof_registry.wasm",
      "sha256": "0000000000000000000000000000000000000000000000000000000000000000",
      "contractVersion": 1,
      "buildMetadata": {
        "rustToolchain": "stable",
        "cargoPackageVersion": "0.1.0",
        "sorobanSdkVersion": "27.0.0",
        "buildProfile": "release",
        "gitCommit": "0000000000000000000000000000000000000000"
      }
    }
  },
  "schemaVersions": [1],
  "commands": [
    "rustup target add wasm32v1-none",
    "stellar contract build",
    "stellar contract deploy --source <source> --network testnet --wasm <wasm>",
    "stellar contract invoke --source <source> --network testnet --id <contract> -- <function>"
  ],
  "notes": "Copy this file after deployment and replace placeholder contract IDs and hashes."
}
